{"schema":"signal-interpreter-observation-batch/v1","batchId":"batch-4db6c5b6-efb1-4225-9179-3f3a5d95dd42","createdAt":"2026-10-08T03:08:31.616Z","trigger":"critical","extensionVersion":"0.10.2","events":[{"schema":"khora-effectif-event/v4","id":"c48772ea-b41f-4a76-8ef4-c1654ee6d69c","sequence":8613,"timestamp":"2026-10-08T03:08:30.183Z","ingestedAt":"2026-10-08T03:08:30.183Z","level":"warn","category":"RUNTIME","component":"background","extensionVersion":"0.10.2","host":"","url":"","phase":"error","action":"PLATFORM_OFFICIAL_HOURLY_SYNC_ERROR","outcome":"error","traceId":"4e89fca9-ce78-4731-9b7b-450d95531468","operationId":null,"parentEventId":null,"attempt":1,"durationMs":null,"tabId":null,"session":{},"environment":{"extensionVersion":"0.10.2","userAgent":"Mozilla/5.0 (Windows NT 10.0; Win64; x64) AppleWebKit/537.36 (KHTML, like Gecko) Chrome/[PHONE] Safari/537.36","platform":"Win32"},"expected":null,"observed":null,"reasonCode":null,"error":"Error: No se pudo sincronizar sin afectar la llamada: abre Cloud Interpreter primero.","metrics":{},"context":{},"privacy":{"rawTextStored":false,"captionTextStored":"[OMITTED]","credentialRedaction":"[REDACTED]"},"payload":{"trigger":"hourly","error":"Error: No se pudo sincronizar sin afectar la llamada: abre Cloud Interpreter primero."}}],"summary":{"eventsTotal":1,"errors":0,"warnings":1,"critical":true,"scopeRejected":0,"contextEvents":0,"invariantSignals":0,"firstSequence":8613,"lastSequence":8613,"firstTimestamp":"2026-10-08T03:08:30.183Z","lastTimestamp":"2026-10-08T03:08:30.183Z","actions":{"PLATFORM_OFFICIAL_HOURLY_SYNC_ERROR":1},"categories":{"RUNTIME":1}}}
