{"schema":"signal-interpreter-observation-batch/v1","batchId":"batch-bf55f483-7669-4ac8-8d98-a0af78572d1a","createdAt":"2026-10-13T16:59:39.769Z","trigger":"critical","extensionVersion":"0.10.29","events":[{"schema":"khora-effectif-event/v4","id":"e6025e2a-24bc-4ca6-a827-a97e9f4f1856","sequence":3743,"timestamp":"2026-10-13T16:57:26.821Z","ingestedAt":"2026-10-13T16:59:37.268Z","level":"info","category":"RUNTIME","component":"content","extensionVersion":"0.10.29","host":"app.cloudinterpreter.com","url":"https://app.cloudinterpreter.com/profile/<ID>","phase":"event","action":"AUTO_ANSWER_READINESS","outcome":"observed","traceId":"745dd0c9-5e37-4f83-a0e7-8a9124ef9201","operationId":null,"parentEventId":null,"attempt":1,"durationMs":null,"tabId":220917123,"session":{"sessionId":"fa3931c6-6f[PHONE]e8-7a8529db0942","pageLifecycleId":"1bc60777-3c77-4147-a[PHONE]ced38","callId":null},"environment":{"extensionVersion":"0.10.29","userAgent":"Mozilla/5.0 (Windows NT 10.0; Win64; x64) AppleWebKit/537.36 (KHTML, like Gecko) Chrome/[PHONE] Safari/537.36","platform":"Win32"},"expected":null,"observed":null,"reasonCode":"heartbeat","error":null,"metrics":{},"context":{"route":"/profile/<ID>","visibility":"visible","focused":true,"online":true,"monotonicMs":76327,"callId":null,"pageLifecycleId":"1bc60777-3c77-4147-a[PHONE]ced38","sourceTabId":220917123,"sourceWindowId":220917056,"observedTabStatus":"complete","observedTabActive":true,"observedTabUrl":"https://app.cloudinterpreter.com/profile/cmu2wuz1v0uwr07adbzb9djfz"},"privacy":{"rawTextStored":false,"captionTextStored":"[OMITTED]","credentialRedaction":"[REDACTED]"},"payload":{"ready":true,"availability":"online","authorizedProfile":true,"route":"/profile/<ID>","exactUrl":"https://app.cloudinterpreter.com/profile/cmu2wuz1v0uwr07adbzb9djfz","runtimeVersion":"0.10.29","reason":"heartbeat"}},{"schema":"khora-effectif-event/v4","id":"b7b2378f-de02-4e25-9103-40ac1e0e74b5","sequence":3744,"timestamp":"2026-10-13T16:57:28.821Z","ingestedAt":"2026-10-13T16:59:38.071Z","level":"info","category":"RUNTIME","component":"content","extensionVersion":"0.10.29","host":"app.cloudinterpreter.com","url":"https://app.cloudinterpreter.com/profile/<ID>","phase":"event","action":"AUTO_ANSWER_READINESS","outcome":"observed","traceId":"cb12638b-0bbb-4d5a-8ccd-6583639547ce","operationId":null,"parentEventId":null,"attempt":1,"durationMs":null,"tabId":220917123,"session":{"sessionId":"fa3931c6-6f[PHONE]e8-7a8529db0942","pageLifecycleId":"1bc60777-3c77-4147-a[PHONE]ced38","callId":null},"environment":{"extensionVersion":"0.10.29","userAgent":"Mozilla/5.0 (Windows NT 10.0; Win64; x64) AppleWebKit/537.36 (KHTML, like Gecko) Chrome/[PHONE] Safari/537.36","platform":"Win32"},"expected":null,"observed":null,"reasonCode":"heartbeat","error":null,"metrics":{},"context":{"route":"/profile/<ID>","visibility":"visible","focused":true,"online":true,"monotonicMs":78327,"callId":null,"pageLifecycleId":"1bc60777-3c77-4147-a[PHONE]ced38","sourceTabId":220917123,"sourceWindowId":220917056,"observedTabStatus":"complete","observedTabActive":true,"observedTabUrl":"https://app.cloudinterpreter.com/profile/cmu2wuz1v0uwr07adbzb9djfz"},"privacy":{"rawTextStored":false,"captionTextStored":"[OMITTED]","credentialRedaction":"[REDACTED]"},"payload":{"ready":true,"availability":"online","authorizedProfile":true,"route":"/profile/<ID>","exactUrl":"https://app.cloudinterpreter.com/profile/cmu2wuz1v0uwr07adbzb9djfz","runtimeVersion":"0.10.29","reason":"heartbeat"}},{"schema":"khora-effectif-event/v4","id":"bde837e7-cc9a-4948-9097-41d23f850b7f","sequence":3745,"timestamp":"2026-10-13T16:57:30.821Z","ingestedAt":"2026-10-13T16:59:38.858Z","level":"info","category":"RUNTIME","component":"content","extensionVersion":"0.10.29","host":"app.cloudinterpreter.com","url":"https://app.cloudinterpreter.com/profile/<ID>","phase":"event","action":"AUTO_ANSWER_READINESS","outcome":"observed","traceId":"352d36a9-f8ad-4f9c-bc91-a1bd7874ab9c","operationId":null,"parentEventId":null,"attempt":1,"durationMs":null,"tabId":220917123,"session":{"sessionId":"fa3931c6-6f[PHONE]e8-7a8529db0942","pageLifecycleId":"1bc60777-3c77-4147-a[PHONE]ced38","callId":null},"environment":{"extensionVersion":"0.10.29","userAgent":"Mozilla/5.0 (Windows NT 10.0; Win64; x64) AppleWebKit/537.36 (KHTML, like Gecko) Chrome/[PHONE] Safari/537.36","platform":"Win32"},"expected":null,"observed":null,"reasonCode":"heartbeat","error":null,"metrics":{},"context":{"route":"/profile/<ID>","visibility":"visible","focused":true,"online":true,"monotonicMs":80327,"callId":null,"pageLifecycleId":"1bc60777-3c77-4147-a[PHONE]ced38","sourceTabId":220917123,"sourceWindowId":220917056,"observedTabStatus":"complete","observedTabActive":true,"observedTabUrl":"https://app.cloudinterpreter.com/profile/cmu2wuz1v0uwr07adbzb9djfz"},"privacy":{"rawTextStored":false,"captionTextStored":"[OMITTED]","credentialRedaction":"[REDACTED]"},"payload":{"ready":true,"availability":"online","authorizedProfile":true,"route":"/profile/<ID>","exactUrl":"https://app.cloudinterpreter.com/profile/cmu2wuz1v0uwr07adbzb9djfz","runtimeVersion":"0.10.29","reason":"heartbeat"}},{"schema":"khora-effectif-event/v4","id":"1afc03e8-e820-4064-bbf9-1492bdd92db4","sequence":3746,"timestamp":"2026-10-13T16:57:32.822Z","ingestedAt":"2026-10-13T16:59:39.670Z","level":"info","category":"RUNTIME","component":"content","extensionVersion":"0.10.29","host":"app.cloudinterpreter.com","url":"https://app.cloudinterpreter.com/profile/<ID>","phase":"event","action":"AUTO_ANSWER_READINESS","outcome":"observed","traceId":"72c8aa2a-9698-44ba-a075-24e958a23801","operationId":null,"parentEventId":null,"attempt":1,"durationMs":null,"tabId":220917123,"session":{"sessionId":"fa3931c6-6f[PHONE]e8-7a8529db0942","pageLifecycleId":"1bc60777-3c77-4147-a[PHONE]ced38","callId":null},"environment":{"extensionVersion":"0.10.29","userAgent":"Mozilla/5.0 (Windows NT 10.0; Win64; x64) AppleWebKit/537.36 (KHTML, like Gecko) Chrome/[PHONE] Safari/537.36","platform":"Win32"},"expected":null,"observed":null,"reasonCode":"heartbeat","error":null,"metrics":{},"context":{"route":"/profile/<ID>","visibility":"visible","focused":true,"online":true,"monotonicMs":82327,"callId":null,"pageLifecycleId":"1bc60777-3c77-4147-a[PHONE]ced38","sourceTabId":220917123,"sourceWindowId":220917056,"observedTabStatus":"complete","observedTabActive":true,"observedTabUrl":"https://app.cloudinterpreter.com/profile/cmu2wuz1v0uwr07adbzb9djfz"},"privacy":{"rawTextStored":false,"captionTextStored":"[OMITTED]","credentialRedaction":"[REDACTED]"},"payload":{"ready":true,"availability":"online","authorizedProfile":true,"route":"/profile/<ID>","exactUrl":"https://app.cloudinterpreter.com/profile/cmu2wuz1v0uwr07adbzb9djfz","runtimeVersion":"0.10.29","reason":"heartbeat"}}],"summary":{"eventsTotal":4,"errors":0,"warnings":0,"critical":false,"scopeRejected":0,"contextEvents":0,"invariantSignals":0,"firstSequence":3743,"lastSequence":3746,"firstTimestamp":"2026-10-13T16:57:26.821Z","lastTimestamp":"2026-10-13T16:57:32.822Z","actions":{"AUTO_ANSWER_READINESS":4},"categories":{"RUNTIME":4}}}
