{"schema":"signal-interpreter-observation-batch/v1","batchId":"batch-26c954b9-03c2-47eb-9925-f13d67627cde","createdAt":"2026-10-08T01:08:30.126Z","trigger":"critical","extensionVersion":"0.10.2","events":[{"schema":"khora-effectif-event/v4","id":"ce1eecc0-2381-4926-82c7-096794ba34a3","sequence":8601,"timestamp":"2026-10-08T01:08:29.569Z","ingestedAt":"2026-10-08T01:08:29.569Z","level":"info","category":"RUNTIME","component":"background","extensionVersion":"0.10.2","host":"","url":"","phase":"started","action":"PLATFORM_OFFICIAL_HOURLY_SYNC_STARTED","outcome":"success","traceId":"e3990be4-04a6-4a4b-8548-7f846f294280","operationId":null,"parentEventId":null,"attempt":1,"durationMs":null,"tabId":null,"session":{},"environment":{"extensionVersion":"0.10.2","userAgent":"Mozilla/5.0 (Windows NT 10.0; Win64; x64) AppleWebKit/537.36 (KHTML, like Gecko) Chrome/[PHONE] Safari/537.36","platform":"Win32"},"expected":null,"observed":null,"reasonCode":null,"error":null,"metrics":{},"context":{},"privacy":{"rawTextStored":false,"captionTextStored":"[OMITTED]","credentialRedaction":"[REDACTED]"},"payload":{"trigger":"hourly"}},{"schema":"khora-effectif-event/v4","id":"29291f04-46be-40cc-a74c-9459af004bb7","sequence":8602,"timestamp":"2026-10-08T01:08:29.870Z","ingestedAt":"2026-10-08T01:08:29.870Z","level":"warn","category":"RUNTIME","component":"background","extensionVersion":"0.10.2","host":"","url":"","phase":"error","action":"EARNINGS_SYNC_QUEUE_ERROR","outcome":"error","traceId":"ecc2ff6a-16b7-458e-92c3-a92f56c466db","operationId":null,"parentEventId":null,"attempt":1,"durationMs":null,"tabId":null,"session":{},"environment":{"extensionVersion":"0.10.2","userAgent":"Mozilla/5.0 (Windows NT 10.0; Win64; x64) AppleWebKit/537.36 (KHTML, like Gecko) Chrome/[PHONE] Safari/537.36","platform":"Win32"},"expected":null,"observed":null,"reasonCode":null,"error":"Error: No se pudo sincronizar sin afectar la llamada: abre Cloud Interpreter primero.","metrics":{},"context":{},"privacy":{"rawTextStored":false,"captionTextStored":"[OMITTED]","credentialRedaction":"[REDACTED]"},"payload":{"operation":"official-today","error":"Error: No se pudo sincronizar sin afectar la llamada: abre Cloud Interpreter primero."}}],"summary":{"eventsTotal":2,"errors":0,"warnings":1,"critical":true,"scopeRejected":0,"contextEvents":0,"invariantSignals":0,"firstSequence":8601,"lastSequence":8602,"firstTimestamp":"2026-10-08T01:08:29.569Z","lastTimestamp":"2026-10-08T01:08:29.870Z","actions":{"PLATFORM_OFFICIAL_HOURLY_SYNC_STARTED":1,"EARNINGS_SYNC_QUEUE_ERROR":1},"categories":{"RUNTIME":2}}}
