{"schema":"signal-interpreter-observation-batch/v1","batchId":"batch-dd7bb210-a61e-49d0-be68-edf8e86b9265","createdAt":"2026-10-29T01:37:51.250Z","trigger":"alarm","extensionVersion":"0.10.37","events":[{"schema":"khora-effectif-event/v4","id":"3bd74e6a-3a05-4cc3-b5df-13841bdba8bd","sequence":6972,"timestamp":"2026-10-29T01:37:50.318Z","ingestedAt":"2026-10-29T01:37:50.318Z","level":"info","category":"RUNTIME","component":"background","extensionVersion":"0.10.37","host":"","url":"","phase":"event","action":"TELEMETRY_MAINTENANCE","outcome":"observed","traceId":"fbfb3a72-9f9a-4fe9-94ed-7c57d4fd2f26","operationId":null,"parentEventId":null,"attempt":1,"durationMs":null,"tabId":null,"session":{},"environment":{"extensionVersion":"0.10.37","userAgent":"Mozilla/5.0 (Windows NT 10.0; Win64; x64) AppleWebKit/537.36 (KHTML, like Gecko) Chrome/[PHONE] Safari/537.36","platform":"Win32"},"expected":null,"observed":null,"reasonCode":null,"error":null,"metrics":{},"context":{},"privacy":{"rawTextStored":false,"captionTextStored":"[OMITTED]","credentialRedaction":"[REDACTED]"},"payload":{"pruned":{"cutoff":"[PHONE]T01:37:50.242Z","expiredEvents":0,"expiredSnapshots":0,"expiredSignalSegments":0,"excessEvents":0,"excessSignalSegments":0},"stats":{"database":"signal-interpreter-telemetry","events":6971,"snapshots":13,"signalSegments":0,"oldestEventAt":"[PHONE]T17:05:33.453Z","newestEventAt":"[PHONE]T01:36:57.269Z","usageBytes":8066928,"quotaBytes":14411851632}}}],"summary":{"eventsTotal":1,"errors":0,"warnings":0,"critical":false,"scopeRejected":0,"contextEvents":0,"invariantSignals":0,"firstSequence":6972,"lastSequence":6972,"firstTimestamp":"2026-10-29T01:37:50.318Z","lastTimestamp":"2026-10-29T01:37:50.318Z","actions":{"TELEMETRY_MAINTENANCE":1},"categories":{"RUNTIME":1}}}
