{"schema":"signal-interpreter-observation-batch/v1","batchId":"batch-1ebd3b58-b70d-4c0d-837a-3b1b1ac36fe7","createdAt":"2026-10-16T10:24:02.905Z","trigger":"critical","extensionVersion":"0.10.29","events":[{"schema":"khora-effectif-event/v4","id":"ed090f21-12ca-45b6-a02d-6041d7d0f7fc","sequence":29382,"timestamp":"2026-10-16T10:24:01.884Z","ingestedAt":"2026-10-16T10:24:01.884Z","level":"info","category":"RUNTIME","component":"background","extensionVersion":"0.10.29","host":"","url":"","phase":"started","action":"PLATFORM_OFFICIAL_HOURLY_SYNC_STARTED","outcome":"success","traceId":"93620245-44a4-4da5-b5cd-eb731d9ba966","operationId":null,"parentEventId":null,"attempt":1,"durationMs":null,"tabId":null,"session":{},"environment":{"extensionVersion":"0.10.29","userAgent":"Mozilla/5.0 (Windows NT 10.0; Win64; x64) AppleWebKit/537.36 (KHTML, like Gecko) Chrome/[PHONE] Safari/537.36","platform":"Win32"},"expected":null,"observed":null,"reasonCode":null,"error":null,"metrics":{},"context":{},"privacy":{"rawTextStored":false,"captionTextStored":"[OMITTED]","credentialRedaction":"[REDACTED]"},"payload":{"trigger":"hourly"}},{"schema":"khora-effectif-event/v4","id":"a931d1bb-1dd9-4926-af83-826005be04e9","sequence":29383,"timestamp":"2026-10-16T10:24:02.371Z","ingestedAt":"2026-10-16T10:24:02.372Z","level":"warn","category":"RUNTIME","component":"background","extensionVersion":"0.10.29","host":"","url":"","phase":"error","action":"EARNINGS_SYNC_QUEUE_ERROR","outcome":"error","traceId":"a7b39c31-97f0-4072-bea1-7e895ef42587","operationId":null,"parentEventId":null,"attempt":1,"durationMs":null,"tabId":null,"session":{},"environment":{"extensionVersion":"0.10.29","userAgent":"Mozilla/5.0 (Windows NT 10.0; Win64; x64) AppleWebKit/537.36 (KHTML, like Gecko) Chrome/[PHONE] Safari/537.36","platform":"Win32"},"expected":null,"observed":null,"reasonCode":null,"error":"Error: No se pudo sincronizar sin afectar la llamada: abre Cloud Interpreter primero.","metrics":{},"context":{},"privacy":{"rawTextStored":false,"captionTextStored":"[OMITTED]","credentialRedaction":"[REDACTED]"},"payload":{"operation":"official-today","error":"Error: No se pudo sincronizar sin afectar la llamada: abre Cloud Interpreter primero."}},{"schema":"khora-effectif-event/v4","id":"ceb99b03-d49e-42de-a48a-cbc547e3fe82","sequence":29384,"timestamp":"2026-10-16T10:24:02.874Z","ingestedAt":"2026-10-16T10:24:02.874Z","level":"warn","category":"RUNTIME","component":"background","extensionVersion":"0.10.29","host":"","url":"","phase":"error","action":"PLATFORM_OFFICIAL_HOURLY_SYNC_ERROR","outcome":"error","traceId":"7f73c65b-6289-47e1-9453-3fc7927fdd1f","operationId":null,"parentEventId":null,"attempt":1,"durationMs":null,"tabId":null,"session":{},"environment":{"extensionVersion":"0.10.29","userAgent":"Mozilla/5.0 (Windows NT 10.0; Win64; x64) AppleWebKit/537.36 (KHTML, like Gecko) Chrome/[PHONE] Safari/537.36","platform":"Win32"},"expected":null,"observed":null,"reasonCode":null,"error":"Error: No se pudo sincronizar sin afectar la llamada: abre Cloud Interpreter primero.","metrics":{},"context":{},"privacy":{"rawTextStored":false,"captionTextStored":"[OMITTED]","credentialRedaction":"[REDACTED]"},"payload":{"trigger":"hourly","error":"Error: No se pudo sincronizar sin afectar la llamada: abre Cloud Interpreter primero."}}],"summary":{"eventsTotal":3,"errors":0,"warnings":2,"critical":true,"scopeRejected":0,"contextEvents":0,"invariantSignals":0,"firstSequence":29382,"lastSequence":29384,"firstTimestamp":"2026-10-16T10:24:01.884Z","lastTimestamp":"2026-10-16T10:24:02.874Z","actions":{"PLATFORM_OFFICIAL_HOURLY_SYNC_STARTED":1,"EARNINGS_SYNC_QUEUE_ERROR":1,"PLATFORM_OFFICIAL_HOURLY_SYNC_ERROR":1},"categories":{"RUNTIME":3}}}
