{"schema":"signal-interpreter-observation-batch/v1","batchId":"batch-9274fcc6-98cf-41ff-9516-e341aeacfe62","createdAt":"2026-10-23T16:43:07.630Z","trigger":"critical","extensionVersion":"0.10.36","events":[{"schema":"khora-effectif-event/v4","id":"9a85dd78-f9c0-4f8f-af77-21fa9031acd3","sequence":29,"timestamp":"2026-10-23T16:42:59.161Z","ingestedAt":"2026-10-23T16:42:59.169Z","level":"warn","category":"CAPTION","component":"live-caption-overlay","extensionVersion":"0.10.36","host":"","url":"","phase":"lifecycle","action":"LIVE_CAPTION_OVERLAY_VISIBILITY_CHANGED","outcome":"degraded","traceId":"339c863f-2867-49d5-892b-bbd3c9666dc9","operationId":null,"parentEventId":null,"attempt":1,"durationMs":null,"tabId":992488320,"session":{"callId":null},"environment":{"extensionVersion":"0.10.36","userAgent":"Mozilla/5.0 (Windows NT 10.0; Win64; x64) AppleWebKit/537.36 (KHTML, like Gecko) Chrome/[PHONE] Safari/537.36","platform":"Win32"},"expected":null,"observed":null,"reasonCode":"page-not-allowed","error":null,"metrics":{},"context":{"route":"/search/warmup.html","visibility":"hidden","online":true,"sourceTabId":992488320,"sourceWindowId":992488319,"observedTabStatus":"complete","observedTabActive":true,"observedTabUrl":"about:blank"},"privacy":{"rawTextStored":false,"captionTextStored":"[OMITTED]","credentialRedaction":"[REDACTED]"},"payload":{"callId":null,"route":"/search/warmup.html","extensionVersion":"0.10.36","visible":false,"reason":"page-not-allowed","hostConnected":false,"contextReady":true,"pageAllowed":false,"callActive":false,"sourceTabMatched":false,"rowCount":0,"display":"unmounted"}},{"schema":"khora-effectif-event/v4","id":"548e126a-1aa9-43e2-b679-442da0e03781","sequence":30,"timestamp":"2026-10-23T16:42:59.162Z","ingestedAt":"2026-10-23T16:42:59.191Z","level":"info","category":"CAPTION","component":"live-caption-overlay","extensionVersion":"0.10.36","host":"","url":"","phase":"lifecycle","action":"LIVE_CAPTION_OVERLAY_CONTEXT_APPLIED","outcome":"observed","traceId":"e45d2775-de50-4a14-9f7c-4caef356c6fe","operationId":null,"parentEventId":null,"attempt":1,"durationMs":null,"tabId":992488320,"session":{"callId":null},"environment":{"extensionVersion":"0.10.36","userAgent":"Mozilla/5.0 (Windows NT 10.0; Win64; x64) AppleWebKit/537.36 (KHTML, like Gecko) Chrome/[PHONE] Safari/537.36","platform":"Win32"},"expected":null,"observed":null,"reasonCode":null,"error":null,"metrics":{},"context":{"route":"/search/warmup.html","visibility":"hidden","online":true,"sourceTabId":992488320,"sourceWindowId":992488319,"observedTabStatus":"complete","observedTabActive":true,"observedTabUrl":"about:blank"},"privacy":{"rawTextStored":false,"captionTextStored":"[OMITTED]","credentialRedaction":"[REDACTED]"},"payload":{"callId":null,"route":"/search/warmup.html","extensionVersion":"0.10.36","enabled":true,"scope":"source-only","pageAllowed":false,"callActive":false,"sourceTabMatched":false,"sourceTabKnown":false,"routeFallbackApplied":false,"historyRows":0,"contextSyncAttempts":1,"contextSyncFailures":0}},{"schema":"khora-effectif-event/v4","id":"457206e2-fb2f-4992-a8ef-f2516ad7d3c1","sequence":31,"timestamp":"2026-10-23T16:43:00.325Z","ingestedAt":"2026-10-23T16:43:00.325Z","level":"info","category":"BILLING","component":"background","extensionVersion":"0.10.36","host":"","url":"","phase":"completed","action":"EXCHANGE_RATE_UPDATED","outcome":"success","traceId":"fdc396f7-9d6c-46d2-b8bb-b8085a5230ef","operationId":null,"parentEventId":null,"attempt":1,"durationMs":null,"tabId":null,"session":{},"environment":{"extensionVersion":"0.10.36","userAgent":"Mozilla/5.0 (Windows NT 10.0; Win64; x64) AppleWebKit/537.36 (KHTML, like Gecko) Chrome/[PHONE] Safari/537.36","platform":"Win32"},"expected":null,"observed":null,"reasonCode":"alarm","error":null,"metrics":{},"context":{},"privacy":{"rawTextStored":false,"captionTextStored":"[OMITTED]","credentialRedaction":"[REDACTED]"},"payload":{"pair":"USD/MXN","rate":18.664963,"rateDate":"[PHONE]","source":"ExchangeRate.fun / hourly snapshot","reason":"alarm"}},{"schema":"khora-effectif-event/v4","id":"f248acd4-1a9a-4fb0-a29c-b0007dd95f19","sequence":32,"timestamp":"2026-10-23T16:43:07.611Z","ingestedAt":"2026-10-23T16:43:07.611Z","level":"warn","category":"PORTAL","component":"webRequest","extensionVersion":"0.10.36","host":"","url":"","phase":"error","action":"NETWORK_REQUEST_ERROR","outcome":"error","traceId":"4c37738e-4cb3-41b3-a877-02fd0c189bef","operationId":null,"parentEventId":null,"attempt":1,"durationMs":null,"tabId":null,"session":{},"environment":{"extensionVersion":"0.10.36","userAgent":"Mozilla/5.0 (Windows NT 10.0; Win64; x64) AppleWebKit/537.36 (KHTML, like Gecko) Chrome/[PHONE] Safari/537.36","platform":"Win32"},"expected":null,"observed":null,"reasonCode":null,"error":"net::ERR_CACHE_MISS","metrics":{},"context":{},"privacy":{"rawTextStored":false,"captionTextStored":"[OMITTED]","credentialRedaction":"[REDACTED]"},"payload":{"method":"GET","type":"font","url":"https://app.cloudinterpreter.com/_next/static/media/primeicons.c7327e2c.woff2","tabId":992488321,"frameId":0,"parentFrameId":-1,"initiator":"https://app.cloudinterpreter.com/","error":"net::ERR_CACHE_MISS","durationMs":1,"privacy":"request-body-and-headers-not-captured"}}],"summary":{"eventsTotal":4,"errors":0,"warnings":2,"critical":true,"scopeRejected":0,"contextEvents":1,"invariantSignals":0,"firstSequence":29,"lastSequence":32,"firstTimestamp":"2026-10-23T16:42:59.161Z","lastTimestamp":"2026-10-23T16:43:07.611Z","actions":{"LIVE_CAPTION_OVERLAY_VISIBILITY_CHANGED":1,"LIVE_CAPTION_OVERLAY_CONTEXT_APPLIED":1,"EXCHANGE_RATE_UPDATED":1,"NETWORK_REQUEST_ERROR":1},"categories":{"CAPTION":2,"BILLING":1,"PORTAL":1}}}
