{
  "schema": "signal-interpreter-observation-batch/v1",
  "batchId": "batch-9c9bce7c-0e82-4136-b556-8a7be1cdfe7e",
  "createdAt": "2026-10-01T23:43:48.442Z",
  "trigger": "critical",
  "extensionVersion": "0.9.3",
  "summary": {
    "eventsTotal": 3,
    "errors": 0,
    "warnings": 2,
    "critical": true,
    "scopeRejected": 0,
    "contextEvents": 0,
    "invariantSignals": 0,
    "firstSequence": 1,
    "lastSequence": 3,
    "firstTimestamp": "2026-10-01T23:43:48.359Z",
    "lastTimestamp": "2026-10-01T23:43:48.436Z",
    "actions": {
      "EXCHANGE_RATE_ERROR": 2,
      "SIGNAL_BRIDGE_CONNECTED": 1
    },
    "categories": {
      "BILLING": 2,
      "BRIDGE": 1
    }
  },
  "events": [
    {
      "schema": "khora-effectif-event/v4",
      "id": "ea897a82-6478-4046-890b-36b507f7efa6",
      "sequence": 1,
      "timestamp": "2026-10-01T23:43:48.359Z",
      "ingestedAt": "2026-10-01T23:43:48.360Z",
      "level": "warn",
      "category": "BILLING",
      "component": "background",
      "phase": "error",
      "action": "EXCHANGE_RATE_ERROR",
      "outcome": "error",
      "traceId": "f945d687-dc13-4178-a87a-fc279edaac5d",
      "operationId": null,
      "parentEventId": null,
      "attempt": 1,
      "durationMs": null,
      "session": {},
      "environment": {
        "extensionVersion": "0.9.3",
        "userAgent": "Mozilla/5.0 (Windows NT 10.0; Win64; x64) AppleWebKit/537.36 (KHTML, like Gecko) Chrome/149.0.0.0 Safari/537.36",
        "platform": "Win32"
      },
      "expected": null,
      "observed": null,
      "reasonCode": "startup",
      "error": "TypeError: Failed to fetch | TypeError: Failed to fetch | TypeError: Failed to fetch",
      "metrics": {},
      "context": "[OMITTED]",
      "privacy": {
        "rawTextStored": "[OMITTED]",
        "captionTextStored": "[OMITTED]",
        "credentialRedaction": "[REDACTED]"
      }
    },
    {
      "schema": "khora-effectif-event/v4",
      "id": "f3586087-12c3-4b6f-a29e-dc72b5bccb60",
      "sequence": 2,
      "timestamp": "2026-10-01T23:43:48.419Z",
      "ingestedAt": "2026-10-01T23:43:48.419Z",
      "level": "warn",
      "category": "BILLING",
      "component": "background",
      "phase": "error",
      "action": "EXCHANGE_RATE_ERROR",
      "outcome": "error",
      "traceId": "6ef316ec-69c2-4943-9f91-0354a125ee7b",
      "operationId": null,
      "parentEventId": null,
      "attempt": 1,
      "durationMs": null,
      "session": {},
      "environment": {
        "extensionVersion": "0.9.3",
        "userAgent": "Mozilla/5.0 (Windows NT 10.0; Win64; x64) AppleWebKit/537.36 (KHTML, like Gecko) Chrome/149.0.0.0 Safari/537.36",
        "platform": "Win32"
      },
      "expected": null,
      "observed": null,
      "reasonCode": "installed",
      "error": "TypeError: Failed to fetch | TypeError: Failed to fetch | TypeError: Failed to fetch",
      "metrics": {},
      "context": "[OMITTED]",
      "privacy": {
        "rawTextStored": "[OMITTED]",
        "captionTextStored": "[OMITTED]",
        "credentialRedaction": "[REDACTED]"
      }
    },
    {
      "schema": "khora-effectif-event/v4",
      "id": "6ed2cb16-1f28-433c-b637-2f924a1f9a46",
      "sequence": 3,
      "timestamp": "2026-10-01T23:43:48.436Z",
      "ingestedAt": "2026-10-01T23:43:48.437Z",
      "level": "info",
      "category": "BRIDGE",
      "component": "signal-bridge",
      "phase": "started",
      "action": "SIGNAL_BRIDGE_CONNECTED",
      "outcome": "success",
      "traceId": "29cda5b0-19a8-4111-8f49-5ec515e54845",
      "operationId": null,
      "parentEventId": null,
      "attempt": 1,
      "durationMs": null,
      "session": {},
      "environment": {
        "extensionVersion": "0.9.3",
        "userAgent": "Mozilla/5.0 (Windows NT 10.0; Win64; x64) AppleWebKit/537.36 (KHTML, like Gecko) Chrome/149.0.0.0 Safari/537.36",
        "platform": "Win32"
      },
      "expected": null,
      "observed": null,
      "reasonCode": null,
      "error": null,
      "metrics": {},
      "context": "[OMITTED]",
      "privacy": {
        "rawTextStored": "[OMITTED]",
        "captionTextStored": "[OMITTED]",
        "credentialRedaction": "[REDACTED]"
      }
    }
  ]
}
