{"schema":"signal-interpreter-observation-batch/v1","batchId":"batch-5d683591-0c94-4daa-b743-efddd79db00d","createdAt":"2026-10-28T21:34:37.603Z","trigger":"event-window","extensionVersion":"0.10.36","events":[{"schema":"khora-effectif-event/v4","id":"c58a7d62-f76f-4de6-9ddb-0ae0c0a36a39","sequence":6833,"timestamp":"2026-10-28T21:34:07.263Z","ingestedAt":"2026-10-28T21:34:07.320Z","level":"info","category":"RUNTIME","component":"content","extensionVersion":"0.10.36","host":"app.cloudinterpreter.com","url":"https://app.cloudinterpreter.com/profile/<ID>","phase":"event","action":"AUTO_ANSWER_READINESS","outcome":"observed","traceId":"3a0bb95f-7bfa-4903-afa7-bc726d7c532c","operationId":null,"parentEventId":null,"attempt":1,"durationMs":null,"tabId":1600161641,"session":{"sessionId":"5b0e772b-596e-400b-94a4-0cd65ed67b29","pageLifecycleId":"131206b[PHONE]-b1d4-78aade7b8cc7","callId":null},"environment":{"extensionVersion":"0.10.36","userAgent":"Mozilla/5.0 (Windows NT 10.0; Win64; x64) AppleWebKit/537.36 (KHTML, like Gecko) Chrome/[PHONE] Safari/537.36","platform":"Win32"},"expected":null,"observed":null,"reasonCode":"heartbeat","error":null,"metrics":{},"context":{"route":"/profile/<ID>","visibility":"hidden","focused":false,"online":true,"monotonicMs":6805999,"callId":null,"pageLifecycleId":"131206b[PHONE]-b1d4-78aade7b8cc7","sourceTabId":1600161641,"sourceWindowId":1600160686,"observedTabStatus":"complete","observedTabActive":false,"observedTabUrl":"https://app.cloudinterpreter.com/profile/cmu2wuz1v0uwr07adbzb9djfz"},"privacy":{"rawTextStored":false,"captionTextStored":"[OMITTED]","credentialRedaction":"[REDACTED]"},"payload":{"ready":true,"availability":"online","authorizedProfile":true,"route":"/profile/<ID>","exactUrl":"https://app.cloudinterpreter.com/profile/cmu2wuz1v0uwr07adbzb9djfz","runtimeVersion":"0.10.36","reason":"heartbeat"}},{"schema":"khora-effectif-event/v4","id":"b13c0bfd-f825-47cc-bccf-bf9dd116f3de","sequence":6834,"timestamp":"2026-10-28T21:34:07.264Z","ingestedAt":"2026-10-28T21:34:07.649Z","level":"info","category":"CAPTION","component":"live-caption-overlay","extensionVersion":"0.10.36","host":"","url":"","phase":"lifecycle","action":"LIVE_CAPTION_OVERLAY_HEALTH","outcome":"observed","traceId":"25349f8e-500d-414c-8b3a-9e30b415a5c4","operationId":null,"parentEventId":null,"attempt":1,"durationMs":null,"tabId":1600161641,"session":{"callId":null},"environment":{"extensionVersion":"0.10.36","userAgent":"Mozilla/5.0 (Windows NT 10.0; Win64; x64) AppleWebKit/537.36 (KHTML, like Gecko) Chrome/[PHONE] Safari/537.36","platform":"Win32"},"expected":null,"observed":null,"reasonCode":null,"error":null,"metrics":{},"context":{"route":"/profile/<ID>","visibility":"hidden","online":true,"sourceTabId":1600161641,"sourceWindowId":1600160686,"observedTabStatus":"complete","observedTabActive":false,"observedTabUrl":"https://app.cloudinterpreter.com/profile/cmu2wuz1v0uwr07adbzb9djfz"},"privacy":{"rawTextStored":false,"captionTextStored":"[OMITTED]","credentialRedaction":"[REDACTED]"},"payload":{"callId":null,"route":"/profile/<ID>","extensionVersion":"0.10.36","activeCallRoute":false,"contextReady":true,"pageAllowed":false,"callActive":false,"sourceTabMatched":true,"sourceTabKnown":true,"hostConnected":true,"shadowRootReady":true,"visible":false,"display":"none","rowCount":0,"active":false,"sessionEnded":true,"lastCaptionAgeMs":null,"contextSyncAttempts":19,"contextSyncFailures":0,"documentReadyState":"complete","online":true}},{"schema":"khora-effectif-event/v4","id":"6f47978f-55fd-4562-9ad1-1d3455e60bf4","sequence":6835,"timestamp":"2026-10-28T21:34:07.264Z","ingestedAt":"2026-10-28T21:34:07.973Z","level":"info","category":"RUNTIME","component":"content","extensionVersion":"0.10.36","host":"app.cloudinterpreter.com","url":"https://app.cloudinterpreter.com/profile/<ID>","phase":"event","action":"PERFORMANCE_HEARTBEAT","outcome":"observed","traceId":"8a6d86db-f65c-417b-b65e-f0e8ccfaab93","operationId":null,"parentEventId":null,"attempt":1,"durationMs":null,"tabId":1600161641,"session":{"sessionId":"5b0e772b-596e-400b-94a4-0cd65ed67b29","pageLifecycleId":"131206b[PHONE]-b1d4-78aade7b8cc7","callId":null},"environment":{"extensionVersion":"0.10.36","userAgent":"Mozilla/5.0 (Windows NT 10.0; Win64; x64) AppleWebKit/537.36 (KHTML, like Gecko) Chrome/[PHONE] Safari/537.36","platform":"Win32"},"expected":null,"observed":null,"reasonCode":"heartbeat","error":null,"metrics":{},"context":{"route":"/profile/<ID>","visibility":"hidden","focused":false,"online":true,"monotonicMs":6806000,"callId":null,"pageLifecycleId":"131206b[PHONE]-b1d4-78aade7b8cc7","sourceTabId":1600161641,"sourceWindowId":1600160686,"observedTabStatus":"complete","observedTabActive":false,"observedTabUrl":"https://app.cloudinterpreter.com/profile/cmu2wuz1v0uwr07adbzb9djfz"},"privacy":{"rawTextStored":false,"captionTextStored":"[OMITTED]","credentialRedaction":"[REDACTED]"},"payload":{"reason":"heartbeat","route":"/profile/<ID>","uptimeMs":6806000,"callId":null,"document":{"readyState":"complete","visibility":"hidden","focused":false,"online":true,"title":"My Profile - Cloud Interpreter","nodes":537},"viewport":{"width":1920,"height":911,"devicePixelRatio":1},"navigation":{"type":"navigate","durationMs":5202,"domInteractiveMs":269,"domContentLoadedMs":5201,"loadMs":5202,"transferBytes":10411},"connection":{"effectiveType":"4g","downlinkMbps":10,"rttMs":50,"saveData":false},"memory":{"usedBytes":39474903,"totalBytes":44656691,"limitBytes":4395630592},"performance":{"longTasks":4,"longTaskTotalMs":4650,"longestTaskMs":4427,"layoutShifts":92,"layoutShiftScore":0.15208465148046635},"mutations":{"batches":7,"addedNodes":7,"removedNodes":6,"attributes":30,"textChanges":0},"resources":{"newResources":0,"byType":{},"totalDurationMs":0,"transferBytes":0,"slowest":[]},"controls":{"buttons":4,"inputs":7,"selects":0,"dialogs":0,"media":0,"iframes":0}}}],"summary":{"eventsTotal":3,"errors":0,"warnings":0,"critical":false,"scopeRejected":0,"contextEvents":0,"invariantSignals":0,"firstSequence":6833,"lastSequence":6835,"firstTimestamp":"2026-10-28T21:34:07.263Z","lastTimestamp":"2026-10-28T21:34:07.264Z","actions":{"AUTO_ANSWER_READINESS":1,"LIVE_CAPTION_OVERLAY_HEALTH":1,"PERFORMANCE_HEARTBEAT":1},"categories":{"RUNTIME":2,"CAPTION":1}}}
