{"schema":"signal-interpreter-observation-batch/v1","batchId":"batch-1f87831f-a546-4f92-9b62-f32afb56c2d2","createdAt":"2026-10-16T22:25:40.031Z","trigger":"event-window","extensionVersion":"0.10.29","events":[{"schema":"khora-effectif-event/v4","id":"d5e4f6ea-6794-4dda-b53d-1f0c5b48afb2","sequence":29627,"timestamp":"2026-10-16T22:25:09.458Z","ingestedAt":"2026-10-16T22:25:09.503Z","level":"warn","category":"CAPTION","component":"live-caption-overlay","extensionVersion":"0.10.29","host":"","url":"","phase":"lifecycle","action":"LIVE_CAPTION_OVERLAY_VISIBILITY_CHANGED","outcome":"degraded","traceId":"679b58d1-7088-4c5b-b7ac-031396e1c5d5","operationId":null,"parentEventId":null,"attempt":1,"durationMs":null,"tabId":220920827,"session":{"callId":null},"environment":{"extensionVersion":"0.10.29","userAgent":"Mozilla/5.0 (Windows NT 10.0; Win64; x64) AppleWebKit/537.36 (KHTML, like Gecko) Chrome/[PHONE] Safari/537.36","platform":"Win32"},"expected":null,"observed":null,"reasonCode":"page-not-allowed","error":null,"metrics":{},"context":{"route":"/victorhugotorresmendez-8991s-projects","visibility":"visible","online":true,"sourceTabId":220920827,"sourceWindowId":220919694,"observedTabStatus":"complete","observedTabActive":true,"observedTabUrl":"https://vercel.com/victorhugotorresmendez-8991s-projects"},"privacy":{"rawTextStored":false,"captionTextStored":"[OMITTED]","credentialRedaction":"[REDACTED]"},"payload":{"callId":null,"route":"/victorhugotorresmendez-8991s-projects","extensionVersion":"0.10.29","visible":false,"reason":"page-not-allowed","hostConnected":false,"contextReady":true,"pageAllowed":false,"callActive":false,"sourceTabMatched":false,"rowCount":0,"display":"unmounted"}},{"schema":"khora-effectif-event/v4","id":"9c8e6acf-5a3e-4f71-9106-1eccdbe0663a","sequence":29628,"timestamp":"2026-10-16T22:25:09.458Z","ingestedAt":"2026-10-16T22:25:10.098Z","level":"info","category":"CAPTION","component":"live-caption-overlay","extensionVersion":"0.10.29","host":"","url":"","phase":"lifecycle","action":"LIVE_CAPTION_OVERLAY_CONTEXT_APPLIED","outcome":"observed","traceId":"b88541c6-5406-4c71-aa53-e72e121aca0d","operationId":null,"parentEventId":null,"attempt":1,"durationMs":null,"tabId":220920827,"session":{"callId":null},"environment":{"extensionVersion":"0.10.29","userAgent":"Mozilla/5.0 (Windows NT 10.0; Win64; x64) AppleWebKit/537.36 (KHTML, like Gecko) Chrome/[PHONE] Safari/537.36","platform":"Win32"},"expected":null,"observed":null,"reasonCode":null,"error":null,"metrics":{},"context":{"route":"/victorhugotorresmendez-8991s-projects","visibility":"visible","online":true,"sourceTabId":220920827,"sourceWindowId":220919694,"observedTabStatus":"complete","observedTabActive":true,"observedTabUrl":"https://vercel.com/victorhugotorresmendez-8991s-projects"},"privacy":{"rawTextStored":false,"captionTextStored":"[OMITTED]","credentialRedaction":"[REDACTED]"},"payload":{"callId":null,"route":"/victorhugotorresmendez-8991s-projects","extensionVersion":"0.10.29","enabled":true,"scope":"source-only","pageAllowed":false,"callActive":false,"sourceTabMatched":false,"sourceTabKnown":true,"routeFallbackApplied":false,"historyRows":0,"contextSyncAttempts":1,"contextSyncFailures":0}},{"schema":"khora-effectif-event/v4","id":"a1b1e323-a0ff-4fdf-8e2c-1ce6d60716ce","sequence":29629,"timestamp":"2026-10-16T22:25:10.572Z","ingestedAt":"2026-10-16T22:25:10.740Z","level":"info","category":"CAPTION","component":"live-caption-overlay","extensionVersion":"0.10.29","host":"","url":"","phase":"lifecycle","action":"LIVE_CAPTION_OVERLAY_ROUTE_CHANGED","outcome":"observed","traceId":"ac188223-50b4-471d-b90b-8ef2d109a017","operationId":null,"parentEventId":null,"attempt":1,"durationMs":null,"tabId":220920827,"session":{"callId":null},"environment":{"extensionVersion":"0.10.29","userAgent":"Mozilla/5.0 (Windows NT 10.0; Win64; x64) AppleWebKit/537.36 (KHTML, like Gecko) Chrome/[PHONE] Safari/537.36","platform":"Win32"},"expected":null,"observed":null,"reasonCode":null,"error":null,"metrics":{},"context":{"route":"/victorhugotorresmendez-8991s-projects","visibility":"visible","online":true,"sourceTabId":220920827,"sourceWindowId":220919694,"observedTabStatus":"complete","observedTabActive":true,"observedTabUrl":"https://vercel.com/victorhugotorresmendez-8991s-projects"},"privacy":{"rawTextStored":false,"captionTextStored":"[OMITTED]","credentialRedaction":"[REDACTED]"},"payload":{"callId":null,"route":"/victorhugotorresmendez-8991s-projects","extensionVersion":"0.10.29","previousRoute":"/victorhugotorresmendez-8991s-projects","currentRoute":"/victorhugotorresmendez-8991s-projects","activeCallRoute":false}}],"summary":{"eventsTotal":3,"errors":0,"warnings":1,"critical":false,"scopeRejected":0,"contextEvents":1,"invariantSignals":0,"firstSequence":29627,"lastSequence":29629,"firstTimestamp":"2026-10-16T22:25:09.458Z","lastTimestamp":"2026-10-16T22:25:10.572Z","actions":{"LIVE_CAPTION_OVERLAY_VISIBILITY_CHANGED":1,"LIVE_CAPTION_OVERLAY_CONTEXT_APPLIED":1,"LIVE_CAPTION_OVERLAY_ROUTE_CHANGED":1},"categories":{"CAPTION":3}}}
