{"schema":"signal-interpreter-observation-batch/v1","batchId":"batch-262c8ee9-aa25-49d3-9fad-9444b97c5cf1","createdAt":"2026-10-10T20:18:55.054Z","trigger":"critical","extensionVersion":"0.10.29","events":[{"schema":"khora-effectif-event/v4","id":"ab95aad4-9e96-4c1e-a420-d0523c12ba35","sequence":301,"timestamp":"2026-10-10T20:18:53.567Z","ingestedAt":"2026-10-10T20:18:53.568Z","level":"error","category":"RUNTIME","component":"platform-screenshot","extensionVersion":"0.10.29","host":"","url":"","phase":"error","action":"PLATFORM_SCREENSHOT_CAPTURE_ERROR","outcome":"error","traceId":"85c308be-9698-4688-8ca9-8f2811b03045","operationId":null,"parentEventId":null,"attempt":1,"durationMs":null,"tabId":null,"session":{},"environment":{"extensionVersion":"0.10.29","userAgent":"Mozilla/5.0 (Windows NT 10.0; Win64; x64) AppleWebKit/537.36 (KHTML, like Gecko) Chrome/[PHONE] Safari/537.36","platform":"Win32"},"expected":null,"observed":null,"reasonCode":"tab-url-changed","error":"Error: Either the '<all_urls>' or 'activeTab' permission is required.","metrics":{},"context":{},"privacy":{"rawTextStored":false,"captionTextStored":"[OMITTED]","credentialRedaction":"[REDACTED]"},"payload":{"tabId":220915734,"windowId":220915732,"route":"/profile/<ID>","error":"Error: Either the '<all_urls>' or 'activeTab' permission is required.","reason":"tab-url-changed"}},{"schema":"khora-effectif-event/v4","id":"e57cdf7f-0217-4ac0-8a9b-dc3f33065368","sequence":302,"timestamp":"2026-10-10T20:18:53.281Z","ingestedAt":"2026-10-10T20:18:53.984Z","level":"info","category":"RUNTIME","component":"content","extensionVersion":"0.10.29","host":"app.cloudinterpreter.com","url":"https://app.cloudinterpreter.com/profile/<ID>","phase":"event","action":"AUTO_ANSWER_READINESS","outcome":"observed","traceId":"24166517-ad67-4858-ad9d-56a46dc159bf","operationId":null,"parentEventId":null,"attempt":1,"durationMs":null,"tabId":220915734,"session":{"sessionId":"7c5cd07f-d[PHONE]b53-612e39925fde","pageLifecycleId":"2cfe4cdc-51f5-444e-a9f2-c91a53573018","callId":null},"environment":{"extensionVersion":"0.10.29","userAgent":"Mozilla/5.0 (Windows NT 10.0; Win64; x64) AppleWebKit/537.36 (KHTML, like Gecko) Chrome/[PHONE] Safari/537.36","platform":"Win32"},"expected":null,"observed":null,"reasonCode":"heartbeat","error":null,"metrics":{},"context":{"route":"/profile/<ID>","visibility":"visible","focused":true,"online":true,"monotonicMs":152212,"callId":null,"pageLifecycleId":"2cfe4cdc-51f5-444e-a9f2-c91a53573018","sourceTabId":220915734,"sourceWindowId":220915732,"observedTabStatus":"complete","observedTabActive":true,"observedTabUrl":"https://app.cloudinterpreter.com/profile/cmu2wuz1v0uwr07adbzb9djfz"},"privacy":{"rawTextStored":false,"captionTextStored":"[OMITTED]","credentialRedaction":"[REDACTED]"},"payload":{"ready":false,"availability":"offline","authorizedProfile":true,"route":"/profile/<ID>","exactUrl":"https://app.cloudinterpreter.com/profile/cmu2wuz1v0uwr07adbzb9djfz","runtimeVersion":"0.10.29","reason":"heartbeat"}},{"schema":"khora-effectif-event/v4","id":"5e645f39-55b2-4a92-a422-e49c2e7c3f13","sequence":303,"timestamp":"2026-10-10T20:18:53.649Z","ingestedAt":"2026-10-10T20:18:54.363Z","level":"info","category":"RUNTIME","component":"content","extensionVersion":"0.10.29","host":"app.cloudinterpreter.com","url":"https://app.cloudinterpreter.com/profile/<ID>","phase":"event","action":"PAGE_LIFECYCLE","outcome":"observed","traceId":"e7474ea9-f6ef-4966-acfb-fec8ea5a7c75","operationId":null,"parentEventId":null,"attempt":1,"durationMs":null,"tabId":220915734,"session":{"sessionId":"7c5cd07f-d[PHONE]b53-612e39925fde","pageLifecycleId":"2cfe4cdc-51f5-444e-a9f2-c91a53573018","callId":null},"environment":{"extensionVersion":"0.10.29","userAgent":"Mozilla/5.0 (Windows NT 10.0; Win64; x64) AppleWebKit/537.36 (KHTML, like Gecko) Chrome/[PHONE] Safari/537.36","platform":"Win32"},"expected":null,"observed":null,"reasonCode":null,"error":null,"metrics":{},"context":{"route":"/profile/<ID>","visibility":"visible","focused":false,"online":true,"monotonicMs":152580,"callId":null,"pageLifecycleId":"2cfe4cdc-51f5-444e-a9f2-c91a53573018","sourceTabId":220915734,"sourceWindowId":220915732,"observedTabStatus":"complete","observedTabActive":true,"observedTabUrl":"https://app.cloudinterpreter.com/profile/cmu2wuz1v0uwr07adbzb9djfz"},"privacy":{"rawTextStored":false,"captionTextStored":"[OMITTED]","credentialRedaction":"[REDACTED]"},"payload":{"event":"blur","persisted":false}},{"schema":"khora-effectif-event/v4","id":"6071d09a-c800-4f7f-9624-b4d5fce03247","sequence":304,"timestamp":"2026-10-10T20:18:53.995Z","ingestedAt":"2026-10-10T20:18:54.680Z","level":"warn","category":"CAPTION","component":"live-caption-overlay","extensionVersion":"0.10.29","host":"","url":"","phase":"lifecycle","action":"LIVE_CAPTION_OVERLAY_VISIBILITY_CHANGED","outcome":"degraded","traceId":"a65e3f12-beaa-4cfb-a42c-3d310587bc29","operationId":null,"parentEventId":null,"attempt":1,"durationMs":null,"tabId":220916950,"session":{"callId":null},"environment":{"extensionVersion":"0.10.29","userAgent":"Mozilla/5.0 (Windows NT 10.0; Win64; x64) AppleWebKit/537.36 (KHTML, like Gecko) Chrome/[PHONE] Safari/537.36","platform":"Win32"},"expected":null,"observed":null,"reasonCode":"page-not-allowed","error":null,"metrics":{},"context":{"route":"/settings/personal-access-tokens","visibility":"hidden","online":true,"sourceTabId":220916950,"sourceWindowId":220915732,"observedTabStatus":"loading","observedTabActive":false,"observedTabUrl":"https://github.com/settings/personal-access-tokens"},"privacy":{"rawTextStored":false,"captionTextStored":"[OMITTED]","credentialRedaction":"[REDACTED]"},"payload":{"callId":null,"route":"/settings/personal-access-tokens","extensionVersion":"0.10.29","visible":false,"reason":"page-not-allowed","hostConnected":false,"contextReady":true,"pageAllowed":false,"callActive":false,"sourceTabMatched":false,"rowCount":0,"display":"unmounted"}},{"schema":"khora-effectif-event/v4","id":"8f2720a9-245c-47b5-86f3-92c42da3575c","sequence":305,"timestamp":"2026-10-10T20:18:53.995Z","ingestedAt":"2026-10-10T20:18:55.002Z","level":"info","category":"CAPTION","component":"live-caption-overlay","extensionVersion":"0.10.29","host":"","url":"","phase":"lifecycle","action":"LIVE_CAPTION_OVERLAY_CONTEXT_APPLIED","outcome":"observed","traceId":"e1c62697-5aef-4dd4-a7e5-beefe325b291","operationId":null,"parentEventId":null,"attempt":1,"durationMs":null,"tabId":220916950,"session":{"callId":null},"environment":{"extensionVersion":"0.10.29","userAgent":"Mozilla/5.0 (Windows NT 10.0; Win64; x64) AppleWebKit/537.36 (KHTML, like Gecko) Chrome/[PHONE] Safari/537.36","platform":"Win32"},"expected":null,"observed":null,"reasonCode":null,"error":null,"metrics":{},"context":{"route":"/settings/personal-access-tokens","visibility":"hidden","online":true,"sourceTabId":220916950,"sourceWindowId":220915732,"observedTabStatus":"loading","observedTabActive":false,"observedTabUrl":"https://github.com/settings/personal-access-tokens"},"privacy":{"rawTextStored":false,"captionTextStored":"[OMITTED]","credentialRedaction":"[REDACTED]"},"payload":{"callId":null,"route":"/settings/personal-access-tokens","extensionVersion":"0.10.29","enabled":true,"scope":"source-only","pageAllowed":false,"callActive":false,"sourceTabMatched":false,"sourceTabKnown":false,"routeFallbackApplied":false,"historyRows":0,"contextSyncAttempts":1,"contextSyncFailures":0}}],"summary":{"eventsTotal":5,"errors":1,"warnings":1,"critical":true,"scopeRejected":0,"contextEvents":1,"invariantSignals":0,"firstSequence":301,"lastSequence":305,"firstTimestamp":"2026-10-10T20:18:53.567Z","lastTimestamp":"2026-10-10T20:18:53.995Z","actions":{"PLATFORM_SCREENSHOT_CAPTURE_ERROR":1,"AUTO_ANSWER_READINESS":1,"PAGE_LIFECYCLE":1,"LIVE_CAPTION_OVERLAY_VISIBILITY_CHANGED":1,"LIVE_CAPTION_OVERLAY_CONTEXT_APPLIED":1},"categories":{"RUNTIME":3,"CAPTION":2}}}
