{"schema":"signal-interpreter-observation-batch/v1","batchId":"batch-f68af41e-16cb-4c06-9bb2-cec7d5486daa","createdAt":"2026-10-09T15:43:30.078Z","trigger":"critical","extensionVersion":"0.10.14","events":[{"schema":"khora-effectif-event/v4","id":"fe42d70e-6835-4097-9219-bffbd33bd077","sequence":2389,"timestamp":"2026-10-09T15:43:28.573Z","ingestedAt":"2026-10-09T15:43:28.573Z","level":"info","category":"RUNTIME","component":"background","extensionVersion":"0.10.14","host":"","url":"","phase":"start","action":"PLATFORM_EARNINGS_RANGE_REQUESTED","outcome":"observed","traceId":"5f0f2e8b-0d48-4a72-8b2b-897be6d7df1e","operationId":null,"parentEventId":null,"attempt":1,"durationMs":null,"tabId":null,"session":{},"environment":{"extensionVersion":"0.10.14","userAgent":"Mozilla/5.0 (Windows NT 10.0; Win64; x64) AppleWebKit/537.36 (KHTML, like Gecko) Chrome/[PHONE] Safari/537.36","platform":"Win32"},"expected":null,"observed":null,"reasonCode":null,"error":null,"metrics":{},"context":{},"privacy":{"rawTextStored":false,"captionTextStored":"[OMITTED]","credentialRedaction":"[REDACTED]"},"payload":{"period":"currentMonth","startIso":"[PHONE]T06:00:00.000Z","endIso":"[PHONE]T15:43:05.606Z","targetTabId":1800214389,"route":"https://app.cloudinterpreter.com/call/<ID>","callSafe":true,"policy":"page-context-authenticated-no-tab-create-no-navigation-no-reload"}},{"schema":"khora-effectif-event/v4","id":"59992b09-b664-446c-b7fa-e4c3dc6db9d5","sequence":2390,"timestamp":"2026-10-09T15:43:05.730Z","ingestedAt":"2026-10-09T15:43:28.862Z","level":"info","category":"RUNTIME","component":"content","extensionVersion":"0.10.14","host":"app.cloudinterpreter.com","url":"https://app.cloudinterpreter.com/call/<ID>","phase":"event","action":"AUTO_ANSWER_READINESS","outcome":"observed","traceId":"470fe71f-9a05-4491-9c14-705ab459f8c5","operationId":null,"parentEventId":null,"attempt":1,"durationMs":null,"tabId":1800214389,"session":{},"environment":{"extensionVersion":"0.10.14","userAgent":"Mozilla/5.0 (Windows NT 10.0; Win64; x64) AppleWebKit/537.36 (KHTML, like Gecko) Chrome/[PHONE] Safari/537.36","platform":"Win32"},"expected":null,"observed":null,"reasonCode":"heartbeat","error":null,"metrics":{},"context":{"route":"/call/<ID>","visibility":"visible","focused":true,"online":true,"monotonicMs":678104,"sourceTabId":1800214389,"sourceWindowId":1800213272,"observedTabStatus":"complete","observedTabActive":true,"observedTabUrl":"https://app.cloudinterpreter.com/call/WTc344738fb6b5b8ec6c3fbf900257ba1a"},"privacy":{"rawTextStored":false,"captionTextStored":"[OMITTED]","credentialRedaction":"[REDACTED]"},"payload":{"ready":false,"availability":"unknown","authorizedProfile":false,"route":"/call/<ID>","exactUrl":"https://app.cloudinterpreter.com/call/WTc344738fb6b5b8ec6c3fbf900257ba1a","runtimeVersion":"0.10.14","reason":"heartbeat"}},{"schema":"khora-effectif-event/v4","id":"4e3ff2c5-9c7d-4a5e-a6cf-dff002da608a","sequence":2391,"timestamp":"2026-10-09T15:43:06.078Z","ingestedAt":"2026-10-09T15:43:29.152Z","level":"info","category":"RUNTIME","component":"content","extensionVersion":"0.10.14","host":"app.cloudinterpreter.com","url":"https://app.cloudinterpreter.com/call/<ID>","phase":"event","action":"AUTO_ANSWER_READINESS","outcome":"observed","traceId":"74c8ad2e-45d9-47b9-a631-6ae7cf2a2963","operationId":null,"parentEventId":null,"attempt":1,"durationMs":null,"tabId":1800214389,"session":{},"environment":{"extensionVersion":"0.10.14","userAgent":"Mozilla/5.0 (Windows NT 10.0; Win64; x64) AppleWebKit/537.36 (KHTML, like Gecko) Chrome/[PHONE] Safari/537.36","platform":"Win32"},"expected":null,"observed":null,"reasonCode":"availability","error":null,"metrics":{},"context":{"route":"/call/<ID>","visibility":"visible","focused":true,"online":true,"monotonicMs":678452,"sourceTabId":1800214389,"sourceWindowId":1800213272,"observedTabStatus":"complete","observedTabActive":true,"observedTabUrl":"https://app.cloudinterpreter.com/call/WTc344738fb6b5b8ec6c3fbf900257ba1a"},"privacy":{"rawTextStored":false,"captionTextStored":"[OMITTED]","credentialRedaction":"[REDACTED]"},"payload":{"ready":false,"availability":"unknown","authorizedProfile":false,"route":"/call/<ID>","exactUrl":"https://app.cloudinterpreter.com/call/WTc344738fb6b5b8ec6c3fbf900257ba1a","runtimeVersion":"0.10.14","reason":"availability"}},{"schema":"khora-effectif-event/v4","id":"9b19ecdb-216c-4990-b0ec-a2b9d2abae0c","sequence":2392,"timestamp":"2026-10-09T15:43:06.078Z","ingestedAt":"2026-10-09T15:43:29.433Z","level":"info","category":"RUNTIME","component":"content","extensionVersion":"0.10.14","host":"app.cloudinterpreter.com","url":"https://app.cloudinterpreter.com/call/<ID>","phase":"event","action":"MEDIA_HEALTH","outcome":"observed","traceId":"8e128dde-3400-4df7-ab28-3db208d24a3b","operationId":null,"parentEventId":null,"attempt":1,"durationMs":null,"tabId":1800214389,"session":{},"environment":{"extensionVersion":"0.10.14","userAgent":"Mozilla/5.0 (Windows NT 10.0; Win64; x64) AppleWebKit/537.36 (KHTML, like Gecko) Chrome/[PHONE] Safari/537.36","platform":"Win32"},"expected":null,"observed":null,"reasonCode":"mutation","error":null,"metrics":{},"context":{"route":"/call/<ID>","visibility":"visible","focused":true,"online":true,"monotonicMs":678452,"sourceTabId":1800214389,"sourceWindowId":1800213272,"observedTabStatus":"complete","observedTabActive":true,"observedTabUrl":"https://app.cloudinterpreter.com/call/WTc344738fb6b5b8ec6c3fbf900257ba1a"},"privacy":{"rawTextStored":false,"captionTextStored":"[OMITTED]","credentialRedaction":"[REDACTED]"},"payload":{"reason":"mutation","callId":"WTc344738fb6b5b8ec6c3fbf900257ba1a","media":[{"index":0,"tag":"audio","readyState":4,"paused":false,"ended":false,"muted":false,"volume":1,"currentTime":3,"hasSrcObject":true,"tracks":[{"kind":"audio","enabled":true,"muted":false,"readyState":"live","sampleRate":48000,"channelCount":1,"echoCancellation":null,"noiseSuppression":null,"autoGainControl":null}]}],"mediaElementsFound":1,"interpretation":"media-elements-present"}},{"schema":"khora-effectif-event/v4","id":"3568079d-4338-44cb-9ff6-03178fdd81d1","sequence":2393,"timestamp":"2026-10-09T15:43:29.744Z","ingestedAt":"2026-10-09T15:43:29.744Z","level":"info","category":"RUNTIME","component":"background","extensionVersion":"0.10.14","host":"","url":"","phase":"completed","action":"PLATFORM_EARNINGS_RANGE_COMPLETED","outcome":"success","traceId":"2aef680f-c85b-4afc-adc3-318ac8e68fe6","operationId":null,"parentEventId":null,"attempt":1,"durationMs":null,"tabId":null,"session":{},"environment":{"extensionVersion":"0.10.14","userAgent":"Mozilla/5.0 (Windows NT 10.0; Win64; x64) AppleWebKit/537.36 (KHTML, like Gecko) Chrome/[PHONE] Safari/537.36","platform":"Win32"},"expected":null,"observed":null,"reasonCode":null,"error":null,"metrics":{},"context":{},"privacy":{"rawTextStored":false,"captionTextStored":"[OMITTED]","credentialRedaction":"[REDACTED]"},"payload":{"period":"currentMonth","method":"page-trpc","earned":"$152.30","callLength":"45695","callCount":"62"}},{"schema":"khora-effectif-event/v4","id":"d07856ae-1cd2-4697-af5f-4eee098285cb","sequence":2394,"timestamp":"2026-10-09T15:43:30.026Z","ingestedAt":"2026-10-09T15:43:30.026Z","level":"info","category":"SESSION","component":"background","extensionVersion":"0.10.14","host":"","url":"","phase":"completed","action":"CALL_START_MONTH_SYNC_COMPLETED","outcome":"success","traceId":"f6063dfd-83d4-4409-9e0d-21e3d3f60ed0","operationId":null,"parentEventId":null,"attempt":1,"durationMs":null,"tabId":null,"session":{},"environment":{"extensionVersion":"0.10.14","userAgent":"Mozilla/5.0 (Windows NT 10.0; Win64; x64) AppleWebKit/537.36 (KHTML, like Gecko) Chrome/[PHONE] Safari/537.36","platform":"Win32"},"expected":null,"observed":null,"reasonCode":null,"error":null,"metrics":{},"context":{},"privacy":{"rawTextStored":false,"captionTextStored":"[OMITTED]","credentialRedaction":"[REDACTED]"},"payload":{"callId":"WTc344738fb6b5b8ec6c3fbf900257ba1a","method":"page-trpc","period":"currentMonth"}}],"summary":{"eventsTotal":6,"errors":0,"warnings":0,"critical":false,"scopeRejected":0,"contextEvents":0,"invariantSignals":0,"firstSequence":2389,"lastSequence":2394,"firstTimestamp":"2026-10-09T15:43:28.573Z","lastTimestamp":"2026-10-09T15:43:30.026Z","actions":{"PLATFORM_EARNINGS_RANGE_REQUESTED":1,"AUTO_ANSWER_READINESS":2,"MEDIA_HEALTH":1,"PLATFORM_EARNINGS_RANGE_COMPLETED":1,"CALL_START_MONTH_SYNC_COMPLETED":1},"categories":{"RUNTIME":5,"SESSION":1}}}
