{"schema":"signal-interpreter-observation-batch/v1","batchId":"batch-98551716-fb0f-4df4-9208-34965382e58b","createdAt":"2026-10-09T23:37:53.844Z","trigger":"alarm","extensionVersion":"0.10.22","events":[{"schema":"khora-effectif-event/v4","id":"0ab85863-5be7-40bd-8af3-a248995f3a07","sequence":543,"timestamp":"2026-10-09T23:37:30.875Z","ingestedAt":"2026-10-09T23:37:30.941Z","level":"info","category":"RUNTIME","component":"content","extensionVersion":"0.10.22","host":"app.cloudinterpreter.com","url":"https://app.cloudinterpreter.com/profile/<ID>","phase":"event","action":"AUTO_ANSWER_READINESS","outcome":"observed","traceId":"96dbe2d7-95d3-4797-9a54-323623b0688c","operationId":null,"parentEventId":null,"attempt":1,"durationMs":null,"tabId":1800213327,"session":{},"environment":{"extensionVersion":"0.10.22","userAgent":"Mozilla/5.0 (Windows NT 10.0; Win64; x64) AppleWebKit/537.36 (KHTML, like Gecko) Chrome/[PHONE] Safari/537.36","platform":"Win32"},"expected":null,"observed":null,"reasonCode":"heartbeat","error":null,"metrics":{},"context":{"route":"/profile/<ID>","visibility":"hidden","focused":false,"online":true,"monotonicMs":1103622,"sourceTabId":1800213327,"sourceWindowId":1800213272,"observedTabStatus":"complete","observedTabActive":false,"observedTabUrl":"https://app.cloudinterpreter.com/profile/cmu2wuz1v0uwr07adbzb9djfz"},"privacy":{"rawTextStored":false,"captionTextStored":"[OMITTED]","credentialRedaction":"[REDACTED]"},"payload":{"ready":false,"availability":"offline","authorizedProfile":true,"route":"/profile/<ID>","exactUrl":"https://app.cloudinterpreter.com/profile/cmu2wuz1v0uwr07adbzb9djfz","runtimeVersion":"0.10.22","reason":"heartbeat"}},{"schema":"khora-effectif-event/v4","id":"2a32b79a-4f05-404b-9a19-982586aeb3e4","sequence":544,"timestamp":"2026-10-09T23:37:30.875Z","ingestedAt":"2026-10-09T23:37:31.248Z","level":"info","category":"RUNTIME","component":"content","extensionVersion":"0.10.22","host":"app.cloudinterpreter.com","url":"https://app.cloudinterpreter.com/profile/<ID>","phase":"event","action":"PERFORMANCE_HEARTBEAT","outcome":"observed","traceId":"a405409d-3284-4665-bbf5-1806712fd5ba","operationId":null,"parentEventId":null,"attempt":1,"durationMs":null,"tabId":1800213327,"session":{},"environment":{"extensionVersion":"0.10.22","userAgent":"Mozilla/5.0 (Windows NT 10.0; Win64; x64) AppleWebKit/537.36 (KHTML, like Gecko) Chrome/[PHONE] Safari/537.36","platform":"Win32"},"expected":null,"observed":null,"reasonCode":"heartbeat","error":null,"metrics":{},"context":{"route":"/profile/<ID>","visibility":"hidden","focused":false,"online":true,"monotonicMs":1103623,"sourceTabId":1800213327,"sourceWindowId":1800213272,"observedTabStatus":"complete","observedTabActive":false,"observedTabUrl":"https://app.cloudinterpreter.com/profile/cmu2wuz1v0uwr07adbzb9djfz"},"privacy":{"rawTextStored":false,"captionTextStored":"[OMITTED]","credentialRedaction":"[REDACTED]"},"payload":{"reason":"heartbeat","route":"/profile/<ID>","uptimeMs":1103622,"document":{"readyState":"complete","visibility":"hidden","focused":false,"online":true,"title":"My Profile - Cloud Interpreter","nodes":543},"viewport":{"width":1920,"height":911,"devicePixelRatio":1},"navigation":{"type":"reload","durationMs":4855,"domInteractiveMs":261,"domContentLoadedMs":4718,"loadMs":4855,"transferBytes":14293},"connection":{"effectiveType":"4g","downlinkMbps":10,"rttMs":50,"saveData":false},"memory":{"usedBytes":22545473,"totalBytes":28440573,"limitBytes":4395630592},"performance":{"longTasks":2,"longTaskTotalMs":4466,"longestTaskMs":4410,"layoutShifts":1,"layoutShiftScore":0.000012134077898219296},"mutations":{"batches":0,"addedNodes":0,"removedNodes":0,"attributes":0,"textChanges":0},"resources":{"newResources":0,"byType":{},"totalDurationMs":0,"transferBytes":0,"slowest":[]},"controls":{"buttons":4,"inputs":11,"selects":0,"dialogs":0,"media":0,"iframes":0}}}],"summary":{"eventsTotal":2,"errors":0,"warnings":0,"critical":false,"scopeRejected":0,"contextEvents":0,"invariantSignals":0,"firstSequence":543,"lastSequence":544,"firstTimestamp":"2026-10-09T23:37:30.875Z","lastTimestamp":"2026-10-09T23:37:30.875Z","actions":{"AUTO_ANSWER_READINESS":1,"PERFORMANCE_HEARTBEAT":1},"categories":{"RUNTIME":2}}}
