{"schema":"signal-interpreter-observation-batch/v1","batchId":"batch-f96434ac-7d29-48d4-97dc-68b2438881dc","createdAt":"2026-10-23T18:45:51.244Z","trigger":"alarm","extensionVersion":"0.10.37","events":[{"schema":"khora-effectif-event/v4","id":"a220ce36-0281-4140-8a35-3fd6d1eb4986","sequence":5876,"timestamp":"2026-10-23T18:45:42.616Z","ingestedAt":"2026-10-23T18:45:42.673Z","level":"info","category":"CAPTION","component":"live-caption-overlay","extensionVersion":"0.10.37","host":"","url":"","phase":"lifecycle","action":"LIVE_CAPTION_OVERLAY_ROUTE_CHANGED","outcome":"observed","traceId":"74c4a2ad-5387-4663-a31f-f808d0f4edef","operationId":null,"parentEventId":null,"attempt":1,"durationMs":null,"tabId":220923300,"session":{"callId":null},"environment":{"extensionVersion":"0.10.37","userAgent":"Mozilla/5.0 (Windows NT 10.0; Win64; x64) AppleWebKit/537.36 (KHTML, like Gecko) Chrome/[PHONE] Safari/537.36","platform":"Win32"},"expected":null,"observed":null,"reasonCode":null,"error":null,"metrics":{},"context":{"route":"/new","visibility":"visible","online":true,"sourceTabId":220923300,"sourceWindowId":220923191,"observedTabStatus":"complete","observedTabActive":true,"observedTabUrl":"https://claude.ai/new"},"privacy":{"rawTextStored":false,"captionTextStored":"[OMITTED]","credentialRedaction":"[REDACTED]"},"payload":{"callId":null,"route":"/new","extensionVersion":"0.10.37","previousRoute":"/chat/18c23b70-5f59-4c36-b680-628c7c1ccd9d","currentRoute":"/new","activeCallRoute":false}}],"summary":{"eventsTotal":1,"errors":0,"warnings":0,"critical":false,"scopeRejected":0,"contextEvents":0,"invariantSignals":0,"firstSequence":5876,"lastSequence":5876,"firstTimestamp":"2026-10-23T18:45:42.616Z","lastTimestamp":"2026-10-23T18:45:42.616Z","actions":{"LIVE_CAPTION_OVERLAY_ROUTE_CHANGED":1},"categories":{"CAPTION":1}}}
