{"schema":"signal-interpreter-observation-batch/v1","batchId":"batch-4235ea7f-119f-4744-a314-5bb4a6c2af93","createdAt":"2026-10-11T20:14:18.393Z","trigger":"critical","extensionVersion":"0.10.35","events":[{"schema":"khora-effectif-event/v4","id":"bd93271f-c8ed-4ac3-8ba4-ee0250392828","sequence":1592,"timestamp":"2026-10-11T20:14:16.982Z","ingestedAt":"2026-10-11T20:14:16.982Z","level":"info","category":"RUNTIME","component":"background","extensionVersion":"0.10.35","host":"","url":"","phase":"event","action":"PLATFORM_TELEMETRY_RECONCILED","outcome":"observed","traceId":"9175461a-58f7-4a67-b6c7-57d56559b782","operationId":null,"parentEventId":null,"attempt":1,"durationMs":null,"tabId":null,"session":{},"environment":{"extensionVersion":"0.10.35","userAgent":"Mozilla/5.0 (Windows NT 10.0; Win64; x64) AppleWebKit/537.36 (KHTML, like Gecko) Chrome/[PHONE] Safari/537.36","platform":"Win32"},"expected":null,"observed":null,"reasonCode":null,"error":null,"metrics":{},"context":{},"privacy":{"rawTextStored":false,"captionTextStored":"[OMITTED]","credentialRedaction":"[REDACTED]"},"payload":{"trigger":"event:availability:online","tabCount":2,"authenticatedCount":2,"onlineCount":1,"callCount":0,"probeErrors":0}},{"schema":"khora-effectif-event/v4","id":"3bd3772a-db48-419a-bdc8-7c40772a87f4","sequence":1593,"timestamp":"2026-10-11T20:13:44.228Z","ingestedAt":"2026-10-11T20:14:17.305Z","level":"info","category":"RUNTIME","component":"content","extensionVersion":"0.10.35","host":"app.cloudinterpreter.com","url":"https://app.cloudinterpreter.com/selfcheck","phase":"event","action":"AUTO_ANSWER_READINESS","outcome":"observed","traceId":"a778839b-948b-4c28-96e0-8aabfa58a1ee","operationId":null,"parentEventId":null,"attempt":1,"durationMs":null,"tabId":1600161908,"session":{"sessionId":"b429a315-de1b-4580-bbc2-7a70bfa3c2e8","pageLifecycleId":"c3df6279-b474-44fe-a73d-121c0ad9271a","callId":null},"environment":{"extensionVersion":"0.10.35","userAgent":"Mozilla/5.0 (Windows NT 10.0; Win64; x64) AppleWebKit/537.36 (KHTML, like Gecko) Chrome/[PHONE] Safari/537.36","platform":"Win32"},"expected":null,"observed":null,"reasonCode":"availability","error":null,"metrics":{},"context":{"route":"/selfcheck","visibility":"visible","focused":true,"online":true,"monotonicMs":2119215,"callId":null,"pageLifecycleId":"c3df6279-b474-44fe-a73d-121c0ad9271a","sourceTabId":1600161908,"sourceWindowId":1600160686,"observedTabStatus":"complete","observedTabActive":true,"observedTabUrl":"https://app.cloudinterpreter.com/selfcheck"},"privacy":{"rawTextStored":false,"captionTextStored":"[OMITTED]","credentialRedaction":"[REDACTED]"},"payload":{"ready":false,"availability":"offline","authorizedProfile":false,"route":"/selfcheck","exactUrl":"https://app.cloudinterpreter.com/selfcheck","runtimeVersion":"0.10.35","reason":"availability"}},{"schema":"khora-effectif-event/v4","id":"8c89bbd8-2ad8-469c-97f0-76b5c8dde065","sequence":1594,"timestamp":"2026-10-11T20:13:44.380Z","ingestedAt":"2026-10-11T20:14:17.641Z","level":"info","category":"RUNTIME","component":"content","extensionVersion":"0.10.35","host":"app.cloudinterpreter.com","url":"https://app.cloudinterpreter.com/selfcheck","phase":"event","action":"AUTO_ANSWER_READINESS","outcome":"observed","traceId":"2ee3714a-8624-4058-b3c7-d9d0c046d2eb","operationId":null,"parentEventId":null,"attempt":1,"durationMs":null,"tabId":1600161908,"session":{"sessionId":"b429a315-de1b-4580-bbc2-7a70bfa3c2e8","pageLifecycleId":"c3df6279-b474-44fe-a73d-121c0ad9271a","callId":null},"environment":{"extensionVersion":"0.10.35","userAgent":"Mozilla/5.0 (Windows NT 10.0; Win64; x64) AppleWebKit/537.36 (KHTML, like Gecko) Chrome/[PHONE] Safari/537.36","platform":"Win32"},"expected":null,"observed":null,"reasonCode":"availability","error":null,"metrics":{},"context":{"route":"/selfcheck","visibility":"visible","focused":true,"online":true,"monotonicMs":2119367,"callId":null,"pageLifecycleId":"c3df6279-b474-44fe-a73d-121c0ad9271a","sourceTabId":1600161908,"sourceWindowId":1600160686,"observedTabStatus":"complete","observedTabActive":true,"observedTabUrl":"https://app.cloudinterpreter.com/selfcheck"},"privacy":{"rawTextStored":false,"captionTextStored":"[OMITTED]","credentialRedaction":"[REDACTED]"},"payload":{"ready":false,"availability":"offline","authorizedProfile":false,"route":"/selfcheck","exactUrl":"https://app.cloudinterpreter.com/selfcheck","runtimeVersion":"0.10.35","reason":"availability"}},{"schema":"khora-effectif-event/v4","id":"fd96f69a-3b9b-43dc-993d-644c15a91712","sequence":1595,"timestamp":"2026-10-11T20:13:44.380Z","ingestedAt":"2026-10-11T20:14:18.004Z","level":"info","category":"RUNTIME","component":"content","extensionVersion":"0.10.35","host":"app.cloudinterpreter.com","url":"https://app.cloudinterpreter.com/selfcheck","phase":"event","action":"SCREEN_MAP","outcome":"observed","traceId":"103256c3-04e1-4082-9fa2-53c01f1e57b6","operationId":null,"parentEventId":null,"attempt":1,"durationMs":null,"tabId":1600161908,"session":{"sessionId":"b429a315-de1b-4580-bbc2-7a70bfa3c2e8","pageLifecycleId":"c3df6279-b474-44fe-a73d-121c0ad9271a","callId":null},"environment":{"extensionVersion":"0.10.35","userAgent":"Mozilla/5.0 (Windows NT 10.0; Win64; x64) AppleWebKit/537.36 (KHTML, like Gecko) Chrome/[PHONE] Safari/537.36","platform":"Win32"},"expected":null,"observed":null,"reasonCode":"mutation","error":null,"metrics":{},"context":{"route":"/selfcheck","visibility":"visible","focused":true,"online":true,"monotonicMs":2119367,"callId":null,"pageLifecycleId":"c3df6279-b474-44fe-a73d-121c0ad9271a","sourceTabId":1600161908,"sourceWindowId":1600160686,"observedTabStatus":"complete","observedTabActive":true,"observedTabUrl":"https://app.cloudinterpreter.com/selfcheck"},"privacy":{"rawTextStored":false,"captionTextStored":"[OMITTED]","credentialRedaction":"[REDACTED]"},"payload":{"reason":"mutation","route":"/selfcheck","title":"Self-check - Cloud Interpreter","controls":{"buttons":4,"dialogs":0,"audio":0,"video":0,"iframes":0}}},{"schema":"khora-effectif-event/v4","id":"8b9d6c6b-9b64-4449-a7d0-c880c7daa1db","sequence":1596,"timestamp":"2026-10-11T20:13:44.717Z","ingestedAt":"2026-10-11T20:14:18.320Z","level":"info","category":"RUNTIME","component":"content","extensionVersion":"0.10.35","host":"app.cloudinterpreter.com","url":"https://app.cloudinterpreter.com/selfcheck","phase":"event","action":"AUTO_ANSWER_READINESS","outcome":"observed","traceId":"a8603267-4d92-4938-aa2a-8bd318335613","operationId":null,"parentEventId":null,"attempt":1,"durationMs":null,"tabId":1600161908,"session":{"sessionId":"b429a315-de1b-4580-bbc2-7a70bfa3c2e8","pageLifecycleId":"c3df6279-b474-44fe-a73d-121c0ad9271a","callId":null},"environment":{"extensionVersion":"0.10.35","userAgent":"Mozilla/5.0 (Windows NT 10.0; Win64; x64) AppleWebKit/537.36 (KHTML, like Gecko) Chrome/[PHONE] Safari/537.36","platform":"Win32"},"expected":null,"observed":null,"reasonCode":"heartbeat","error":null,"metrics":{},"context":{"route":"/selfcheck","visibility":"visible","focused":true,"online":true,"monotonicMs":2119704,"callId":null,"pageLifecycleId":"c3df6279-b474-44fe-a73d-121c0ad9271a","sourceTabId":1600161908,"sourceWindowId":1600160686,"observedTabStatus":"complete","observedTabActive":true,"observedTabUrl":"https://app.cloudinterpreter.com/selfcheck"},"privacy":{"rawTextStored":false,"captionTextStored":"[OMITTED]","credentialRedaction":"[REDACTED]"},"payload":{"ready":false,"availability":"offline","authorizedProfile":false,"route":"/selfcheck","exactUrl":"https://app.cloudinterpreter.com/selfcheck","runtimeVersion":"0.10.35","reason":"heartbeat"}}],"summary":{"eventsTotal":5,"errors":0,"warnings":0,"critical":false,"scopeRejected":0,"contextEvents":0,"invariantSignals":0,"firstSequence":1592,"lastSequence":1596,"firstTimestamp":"2026-10-11T20:14:16.982Z","lastTimestamp":"2026-10-11T20:13:44.717Z","actions":{"PLATFORM_TELEMETRY_RECONCILED":1,"AUTO_ANSWER_READINESS":3,"SCREEN_MAP":1},"categories":{"RUNTIME":5}}}
