{"schema":"signal-interpreter-observation-batch/v1","batchId":"batch-04a15db9-5b70-4703-acfb-e39dbe61dac0","createdAt":"2026-10-30T08:37:26.540Z","trigger":"event-window","extensionVersion":"0.10.37","events":[{"schema":"khora-effectif-event/v4","id":"e5fdf837-4f48-4288-a9e1-d7fa874836c6","sequence":7128,"timestamp":"2026-10-30T08:36:56.436Z","ingestedAt":"2026-10-30T08:36:56.437Z","level":"info","category":"BILLING","component":"background","extensionVersion":"0.10.37","host":"","url":"","phase":"completed","action":"EXCHANGE_RATE_UPDATED","outcome":"success","traceId":"4e32cd72-8b25-4f4b-ba10-fdcdba7d5537","operationId":null,"parentEventId":null,"attempt":1,"durationMs":null,"tabId":null,"session":{},"environment":{"extensionVersion":"0.10.37","userAgent":"Mozilla/5.0 (Windows NT 10.0; Win64; x64) AppleWebKit/537.36 (KHTML, like Gecko) Chrome/[PHONE] Safari/537.36","platform":"Win32"},"expected":null,"observed":null,"reasonCode":"alarm","error":null,"metrics":{},"context":{},"privacy":{"rawTextStored":false,"captionTextStored":"[OMITTED]","credentialRedaction":"[REDACTED]"},"payload":{"pair":"USD/MXN","rate":18.87194,"rateDate":"[PHONE]","source":"ExchangeRate.fun / hourly snapshot","reason":"alarm"}}],"summary":{"eventsTotal":1,"errors":0,"warnings":0,"critical":false,"scopeRejected":0,"contextEvents":0,"invariantSignals":0,"firstSequence":7128,"lastSequence":7128,"firstTimestamp":"2026-10-30T08:36:56.436Z","lastTimestamp":"2026-10-30T08:36:56.436Z","actions":{"EXCHANGE_RATE_UPDATED":1},"categories":{"BILLING":1}}}
