{"schema":"signal-interpreter-observation-batch/v1","batchId":"batch-a6f3a23d-25cb-47aa-9845-a43ddd71c284","createdAt":"2026-10-08T15:08:30.076Z","trigger":"critical","extensionVersion":"0.10.2","events":[{"schema":"khora-effectif-event/v4","id":"b65f6ea3-41e9-4d02-8095-e244d260aca5","sequence":8671,"timestamp":"2026-10-08T15:08:29.569Z","ingestedAt":"2026-10-08T15:08:29.569Z","level":"info","category":"RUNTIME","component":"background","extensionVersion":"0.10.2","host":"","url":"","phase":"started","action":"PLATFORM_OFFICIAL_HOURLY_SYNC_STARTED","outcome":"success","traceId":"3eaccdfc-0a09-4ad4-986e-f29442d75bb3","operationId":null,"parentEventId":null,"attempt":1,"durationMs":null,"tabId":null,"session":{},"environment":{"extensionVersion":"0.10.2","userAgent":"Mozilla/5.0 (Windows NT 10.0; Win64; x64) AppleWebKit/537.36 (KHTML, like Gecko) Chrome/[PHONE] Safari/537.36","platform":"Win32"},"expected":null,"observed":null,"reasonCode":null,"error":null,"metrics":{},"context":{},"privacy":{"rawTextStored":false,"captionTextStored":"[OMITTED]","credentialRedaction":"[REDACTED]"},"payload":{"trigger":"hourly"}},{"schema":"khora-effectif-event/v4","id":"8b0704c5-f4bb-4f3b-87df-16acdbe50140","sequence":8672,"timestamp":"2026-10-08T15:08:29.848Z","ingestedAt":"2026-10-08T15:08:29.848Z","level":"warn","category":"RUNTIME","component":"background","extensionVersion":"0.10.2","host":"","url":"","phase":"error","action":"EARNINGS_SYNC_QUEUE_ERROR","outcome":"error","traceId":"bf387d89-532a-44d3-89e6-6c3433b62b4a","operationId":null,"parentEventId":null,"attempt":1,"durationMs":null,"tabId":null,"session":{},"environment":{"extensionVersion":"0.10.2","userAgent":"Mozilla/5.0 (Windows NT 10.0; Win64; x64) AppleWebKit/537.36 (KHTML, like Gecko) Chrome/[PHONE] Safari/537.36","platform":"Win32"},"expected":null,"observed":null,"reasonCode":null,"error":"Error: No se pudo sincronizar sin afectar la llamada: abre Cloud Interpreter primero.","metrics":{},"context":{},"privacy":{"rawTextStored":false,"captionTextStored":"[OMITTED]","credentialRedaction":"[REDACTED]"},"payload":{"operation":"official-today","error":"Error: No se pudo sincronizar sin afectar la llamada: abre Cloud Interpreter primero."}}],"summary":{"eventsTotal":2,"errors":0,"warnings":1,"critical":true,"scopeRejected":0,"contextEvents":0,"invariantSignals":0,"firstSequence":8671,"lastSequence":8672,"firstTimestamp":"2026-10-08T15:08:29.569Z","lastTimestamp":"2026-10-08T15:08:29.848Z","actions":{"PLATFORM_OFFICIAL_HOURLY_SYNC_STARTED":1,"EARNINGS_SYNC_QUEUE_ERROR":1},"categories":{"RUNTIME":2}}}
