{"schema":"signal-interpreter-observation-batch/v1","batchId":"batch-cce31bd0-4a79-4951-bd88-e2adfe38be61","createdAt":"2026-10-11T19:38:44.629Z","trigger":"critical","extensionVersion":"0.10.35","events":[{"schema":"khora-effectif-event/v4","id":"74528013-ad1a-4e85-81c9-28df2f0f4632","sequence":218,"timestamp":"2026-10-11T19:38:43.247Z","ingestedAt":"2026-10-11T19:38:43.270Z","level":"info","category":"RUNTIME","component":"content","extensionVersion":"0.10.35","host":"app.cloudinterpreter.com","url":"https://app.cloudinterpreter.com/profile/<ID>","phase":"event","action":"AUTO_ANSWER_READINESS","outcome":"observed","traceId":"7c8163b9-b032-49dd-9d84-7784641102ca","operationId":null,"parentEventId":null,"attempt":1,"durationMs":null,"tabId":1600161908,"session":{"sessionId":"c7c28722-fac7-4302-be2a-d5e927e2ebb8","pageLifecycleId":"ccaf60c8-25e4-42ae-8a9e-106e725d35a3","callId":null},"environment":{"extensionVersion":"0.10.35","userAgent":"Mozilla/5.0 (Windows NT 10.0; Win64; x64) AppleWebKit/537.36 (KHTML, like Gecko) Chrome/[PHONE] Safari/537.36","platform":"Win32"},"expected":null,"observed":null,"reasonCode":"heartbeat","error":null,"metrics":{},"context":{"route":"/profile/<ID>","visibility":"hidden","focused":false,"online":true,"monotonicMs":18234,"callId":null,"pageLifecycleId":"ccaf60c8-25e4-42ae-8a9e-106e725d35a3","sourceTabId":1600161908,"sourceWindowId":1600160686,"observedTabStatus":"complete","observedTabActive":false,"observedTabUrl":"https://app.cloudinterpreter.com/profile/cmu2wuz1v0uwr07adbzb9djfz"},"privacy":{"rawTextStored":false,"captionTextStored":"[OMITTED]","credentialRedaction":"[REDACTED]"},"payload":{"ready":true,"availability":"online","authorizedProfile":true,"route":"/profile/<ID>","exactUrl":"https://app.cloudinterpreter.com/profile/cmu2wuz1v0uwr07adbzb9djfz","runtimeVersion":"0.10.35","reason":"heartbeat"}}],"summary":{"eventsTotal":1,"errors":0,"warnings":0,"critical":false,"scopeRejected":0,"contextEvents":0,"invariantSignals":0,"firstSequence":218,"lastSequence":218,"firstTimestamp":"2026-10-11T19:38:43.247Z","lastTimestamp":"2026-10-11T19:38:43.247Z","actions":{"AUTO_ANSWER_READINESS":1},"categories":{"RUNTIME":1}}}
